id,ANO,MP,SOLUCAO,DESENVOLVEDOR,CATEGORIA,ABRANGENCIA,FUNCIONALIDADE,FINALIDADE,PERMISSIONAMENTO,FONTE,CONTATO,CONSUMO,LINK
786,2023,MPGO,GUARDIAO,DIGITRO,GERAIS,Não se aplica,Ferramenta implementa interceptacao telefonica dinamica mediante ordem judicial e exibe analise de metadados,Investigação,Geral,Contrato,Pedro Cunali <pedro.cunali@digitro.com>,WS - Web Service,https://www.digitro.com/
787,2023,MPGO,CAESB,CIA SANEAMENTO DF,GERAIS,ESTADUAL,Dados cadastrais clientes da Caesb,Investigação,Restrito,Conv. Direto,,Consulta on line,https://www.caesb.df.gov.br/consulta-orgaos-externos.html#conceitual
788,2023,MPGO,COPASA,CIA SANEAMENTO MG,GERAIS,ESTADUAL,Dados cadastrais clientes da Copasa,Investigação,Restrito,Conv. Direto,,Consulta on line,https://www2.copasa.com.br/servicos/opinfo/Default.aspx
789,2023,MPGO,Ofício Eletrônico,ONR,GERAIS,NACIONAL,Disponibiliza o acesso as Certidões de inteiro teor sobre imóveis registrados nos cartórios de imóveis em todas as unidades da federação,Investigação,Restrito,Conv. Direto,,Consulta on line,https://www.oficioeletronico.com.br/
790,2023,MPGO,Confirme Online,Credilink,GERAIS,NACIONAL,Dados cadastrais de pessoas físicas e jurídicas,Inteligência,Restrito,Conv. Direto,,Consulta on line,https://www.credilink.com.br/nova-area-do-cliente/
791,2023,MPGO,Goias Biométrico,SSP-GO,GERAIS,ESTADUAL,Sistema de Identificação Biométrica - Secretaria de Segurança Pública de Goiás,Investigação,Restrito,Conv. Direto,,Consulta on line,http://goiasbiometrico.ssp.go.gov.br/SSPGO/Default.aspx
792,2023,MPGO,JUCEG,Junta Comercial de Goiás,GERAIS,ESTADUAL,Dados cadastrais sobre pessoas jurídicas empresariais registradas em Goiás,Investigação,Restrito,Conv. Direto,,Consulta on line,https://servicos.juceg.go.gov.br/convenios/interface/login.xhtml
793,2023,MPGO,PROJUDI,TJGO,GERAIS,ESTADUAL,Informações sobre processos judiciais em tramitação em Goiás,Investigação,Restrito,Conv. Direto,,Consulta on line,https://intranet.mpgo.mp.br/pai3/projudi
794,2023,MPGO,SICAR,Sistema NACIONAL de Cadastro Ambiental Rural,GERAIS,ESTADUAL,Dados sobre propriedades em Goiás cadastradas no CAR,Investigação,Restrito,Conv. Direto,,Consulta on line,https://www.car.gov.br/#/intranet/acesso
795,2023,MPGO,AGRODEFESA,PAI,GERAIS,ESTADUAL,"Web Service da Agrodefesa para acesso aos dados cadastrais de proprietários, propriedades rurais e movimentações de animais",Investigação,Geral,Dev. Interno,,Aplicacao especifica,https://intranet.mpgo.mp.br/pai3/agrodefesa
796,2023,MPGO,IPASGO,PAI,GERAIS,ESTADUAL,Web Service do Ipasgo para acesso aos dados cadastrais do servidores do estados de Goiás e seus dependentes,Investigação,Geral,Dev. Interno,,Aplicacao especifica,https://intranet.mpgo.mp.br/pai3/ipasgo
797,2023,MPGO,TCM-GO,Forseti,GERAIS,ESTADUAL,"Web Service do Tribunal de Contas dos Municípios(TCM)para acesso aos dados de contratos, empenhos, folhas de pagamento, Colare e servidores",Investigação,Geral,Dev. Interno,,Aplicacao especifica,https://intranet.mpgo.mp.br/forseti/inteligencia_dados
798,2023,MPGO,Nota Fiscal Eletrônica,Forseti,GERAIS,ESTADUAL,Dados sobre notas fiscais emitidas para entidades públicas goianas,Investigação,Geral,Dev. Interno,,Aplicacao especifica,https://intranet.mpgo.mp.br/forseti/inteligencia_dados
799,2023,MPGO,CGE,Forseti,GERAIS,ESTADUAL,"Dados sobre contratos, gastos públicos e servidores estaduais",Investigação,Geral,Dev. Interno,,Aplicacao especifica,https://intranet.mpgo.mp.br/forseti/inteligencia_dados
800,2023,MPGO,ANAC,Forseti,GERAIS,NACIONAL,Dados cadastrais sobre aeronaves regsitradas no país,Investigação,Geral,Dev. Interno,,Aplicacao especifica,https://intranet.mpgo.mp.br/pai3/consulta_integrada/pessoa_fisica/results
801,2023,MPGO,SANEAGO,PAI,GERAIS,ESTADUAL,Web service para acesso a dados cadastrais sobre clientes da Saneago,Investigação,Geral,Dev. Interno,,Aplicacao especifica,https://intranet.mpgo.mp.br/pai3/consulta_integrada/pessoa_fisica/results
802,2023,MPGO,TRANSPARÊNCIA BRASIL,PAI E Forseti,GERAIS,NACIONAL,"Web Service da Transparência Brasil para acesso aos dados do Auxílio Emergencial, Servidores do Poder Executivo Federal, Convênios e Pessoas Expostas Politicamente (PEP);",Investigação,Geral,Outro,,Aplicacao especifica,https://intranet.mpgo.mp.br/pai3/consulta_integrada/pessoa_fisica/results
803,2023,MPGO,SINAFLOR,IBAMA,GERAIS,NACIONAL,Dados cadastrais -superficiais - sobre propriedades rurais,Investigação,Restrito,Conv. Direto,,Consulta on line,https://sinaflor-int.ibama.gov.br/
804,2023,MPGO,CNES,Cadastro NACIONAL de Estabelecimentos de Saúde,GERAIS,NACIONAL,Dados cadastrais sobre estabelecimentos e profissionais da área da saúde,Investigação,Geral,Outro,,Consulta on line,https://cnes.datasus.gov.br/pages/consultas.jsp
805,2023,MPGO,ATENA,MPGO,GERAIS,ESTADUAL,Informações sobre procedimentos e processos judiciais com atuação direta do MPGO,Investigação,Geral,Outro,,Consulta on line,https://intranet.mpgo.mp.br/atena-4/pagina_inicial
806,2023,MPGO,STRIX,Strix.com,GERAIS,Não se aplica,Sistema de análise telefônica e telemática,Investigação,Restrito,Contrato,,Consulta on line,https://mpgo.m1strix.com/login
807,2023,MPGO,HARPIA,SSP-GO,GERAIS,ESTADUAL,Pesquisas por reconhecimento facial e nominal de investigados,Investigação,Restrito,Outro,,Consulta on line,https://harpia.ssp.go.gov.br/#!/login
808,2023,MPGO,Mportal,SSP-GO,GERAIS,ESTADUAL,Pesquisas de informações sobre registros policiais,Investigação,Restrito,Outro,,Consulta on line,https://mportal.ssp.go.gov.br/#/
809,2023,MPGO,CNIB,Corregedoria NACIONAL de Justiça,GERAIS,NACIONAL,A CNIB realiza verdadeiro rastreamento de todos os bens que o atingido pela indisponibilidade possui em território nacional.,Investigação,Restrito,Conv. Direto,,Aplicacao especifica,https://intranet.mpgo.mp.br/pai3/cnib
810,2023,MPGO,FILIA,TSE,GERAIS,NACIONAL,Certidões sobre filiações partidárias,Investigação,Geral,Outro,,Consulta on line,https://www.tse.jus.br/partidos/filiacao-partidaria/relacao-de-filiados
811,2023,MPGO,DIVULGACAND,TSE,GERAIS,NACIONAL,Prestações de contas sobre campanhas eleitorais,Investigação,Geral,Outro,,Consulta on line,https://divulgacandcontas.tse.jus.br/divulga/#/
812,2023,MPGO,PAI,MPGO,GERAIS,ESTADUAL,Web Service do Detran para acesso aos dados de CNH e Veículos,Investigação,Restrito,Dev. Interno,CSI-MPGO,Aplicacao especifica,Intranet MPGO
813,2023,MPGO,PAI,MPGO,GERAIS,ESTADUAL,Web Service da SSPGO para acesso aos dados de RG e ocorrências,Investigação,Restrito,Dev. Interno,CSI-MPGO,Aplicacao especifica,Intranet MPGO
814,2023,MPGO,PAI,MPGO,GERAIS,NACIONAL,TSE - Banco de dados de doações eleitorais,Investigação,Restrito,Dev. Interno,CSI-MPGO,Aplicacao especifica,Intranet MPGO
815,2023,MPGO,PAI,MPGO,GERAIS,ESTADUAL,Web Service da SEMAD para acesso aos dados de processos de meio ambiente,Investigação,Restrito,Dev. Interno,CSI-MPGO,Aplicacao especifica,Intranet MPGO
816,2023,MPGO,PAI,MPGO,GERAIS,ESTADUAL,Goiaspen - Consulta o prontuário de presos e unidades prisionais,Investigação,Restrito,Dev. Interno,CSI-MPGO,Aplicacao especifica,Intranet MPGO
817,2023,MPGO,PAI,MPGO,GERAIS,NACIONAL,SIEL - Consulta o sistema de informações eleitorais do TSE,Investigação,Restrito,Dev. Interno,CSI-MPGO,Aplicacao especifica,Intranet MPGO
818,2023,MPGO,PAI,MPGO,GERAIS,NACIONAL,COAF - Consulta de movimentações financeiras atípicas,Investigação,Restrito,Dev. Interno,CSI-MPGO,Aplicacao especifica,Intranet MPGO
819,2023,MPGO,PAI,MPGO,GERAIS,ESTADUAL,Web Service do Detran para acesso aos dados de CNH e Veículos,Investigação,Restrito,Dev. Interno,CSI-MPGO,Aplicacao especifica,Intranet MPGO
820,2023,MPGO,PAI,MPGO,GERAIS,ESTADUAL,Web Service da SSPGO para acesso aos dados de RG e ocorrências,Investigação,Restrito,Dev. Interno,CSI-MPGO,Aplicacao especifica,Intranet MPGO
821,2023,MPGO,PAI,MPGO,GERAIS,NACIONAL,TSE - Banco de dados de doações eleitorais,Investigação,Restrito,Dev. Interno,CSI-MPGO,Aplicacao especifica,Intranet MPGO
822,2023,MPGO,PAI,MPGO,GERAIS,ESTADUAL,Web Service da SEMAD para acesso aos dados de processos de meio ambiente,Investigação,Restrito,Dev. Interno,CSI-MPGO,Aplicacao especifica,Intranet MPGO
823,2023,MPGO,PAI,MPGO,GERAIS,ESTADUAL,Goiaspen - Consulta o prontuário de presos e unidades prisionais,Investigação,Restrito,Dev. Interno,CSI-MPGO,Aplicacao especifica,Intranet MPGO
824,2023,MPGO,PAI,MPGO,GERAIS,NACIONAL,SIEL - Consulta o sistema de informações eleitorais do TSE,Investigação,Restrito,Dev. Interno,CSI-MPGO,Aplicacao especifica,Intranet MPGO
825,2023,MPGO,PAI,MPGO,GERAIS,NACIONAL,COAF - Consulta de movimentações financeiras atípicas,Investigação,Restrito,Dev. Interno,CSI-MPGO,Aplicacao especifica,Intranet MPGO
826,2023,MPGO,PAI,MPGO,GERAIS,ESTADUAL,Web Service do Detran para acesso aos dados de CNH e Veículos,Investigação,Restrito,Dev. Interno,CSI-MPGO,Aplicacao especifica,Intranet MPGO
827,2023,MPGO,PAI,MPGO,GERAIS,ESTADUAL,Web Service da SSPGO para acesso aos dados de RG e ocorrências,Investigação,Restrito,Dev. Interno,CSI-MPGO,Aplicacao especifica,Intranet MPGO
828,2023,MPGO,PAI,MPGO,GERAIS,NACIONAL,TSE - Banco de dados de doações eleitorais,Investigação,Restrito,Dev. Interno,CSI-MPGO,Aplicacao especifica,Intranet MPGO
829,2023,MPGO,PAI,MPGO,GERAIS,ESTADUAL,Web Service da SEMAD para acesso aos dados de processos de meio ambiente,Investigação,Restrito,Dev. Interno,CSI-MPGO,Aplicacao especifica,Intranet MPGO
830,2023,MPGO,PAI,MPGO,GERAIS,ESTADUAL,Goiaspen - Consulta o prontuário de presos e unidades prisionais,Investigação,Restrito,Dev. Interno,CSI-MPGO,Aplicacao especifica,Intranet MPGO
831,2023,MPGO,PAI,MPGO,GERAIS,NACIONAL,SIEL - Consulta o sistema de informações eleitorais do TSE,Investigação,Restrito,Dev. Interno,CSI-MPGO,Aplicacao especifica,Intranet MPGO
832,2023,MPGO,PAI,MPGO,GERAIS,NACIONAL,COAF - Consulta de movimentações financeiras atípicas,Investigação,Restrito,Dev. Interno,CSI-MPGO,Aplicacao especifica,Intranet MPGO
833,2023,MPGO,PAI,MPGO,GERAIS,ESTADUAL,Web Service do Detran para acesso aos dados de CNH e Veículos,Investigação,Restrito,Dev. Interno,CSI-MPGO,Aplicacao especifica,Intranet MPGO
834,2023,MPGO,PAI,MPGO,GERAIS,ESTADUAL,Web Service da SSPGO para acesso aos dados de RG e ocorrências,Investigação,Restrito,Dev. Interno,CSI-MPGO,Aplicacao especifica,Intranet MPGO
835,2023,MPGO,PAI,MPGO,GERAIS,NACIONAL,TSE - Banco de dados de doações eleitorais,Investigação,Restrito,Dev. Interno,CSI-MPGO,Aplicacao especifica,Intranet MPGO
836,2023,MPGO,PAI,MPGO,GERAIS,ESTADUAL,Web Service da SEMAD para acesso aos dados de processos de meio ambiente,Investigação,Restrito,Dev. Interno,CSI-MPGO,Aplicacao especifica,Intranet MPGO
837,2023,MPGO,PAI,MPGO,GERAIS,ESTADUAL,Goiaspen - Consulta o prontuário de presos e unidades prisionais,Investigação,Restrito,Dev. Interno,CSI-MPGO,Aplicacao especifica,Intranet MPGO
838,2023,MPGO,PAI,MPGO,GERAIS,NACIONAL,SIEL - Consulta o sistema de informações eleitorais do TSE,Investigação,Restrito,Dev. Interno,CSI-MPGO,Aplicacao especifica,Intranet MPGO
839,2023,MPGO,PAI,MPGO,GERAIS,NACIONAL,COAF - Consulta de movimentações financeiras atípicas,Investigação,Restrito,Dev. Interno,CSI-MPGO,Aplicacao especifica,Intranet MPGO
840,2023,MPGO,PAI,MPGO,GERAIS,ESTADUAL,Web Service do Detran para acesso aos dados de CNH e Veículos,Investigação,Restrito,Dev. Interno,CSI-MPGO,Aplicacao especifica,Intranet MPGO
841,2023,MPGO,PAI,MPGO,GERAIS,ESTADUAL,Web Service da SSPGO para acesso aos dados de RG e ocorrências,Investigação,Restrito,Dev. Interno,CSI-MPGO,Aplicacao especifica,Intranet MPGO
842,2023,MPGO,PAI,MPGO,GERAIS,NACIONAL,TSE - Banco de dados de doações eleitorais,Investigação,Restrito,Dev. Interno,CSI-MPGO,Aplicacao especifica,Intranet MPGO
843,2023,MPGO,PAI,MPGO,GERAIS,ESTADUAL,Web Service da SEMAD para acesso aos dados de processos de meio ambiente,Investigação,Restrito,Dev. Interno,CSI-MPGO,Aplicacao especifica,Intranet MPGO
844,2023,MPGO,PAI,MPGO,GERAIS,ESTADUAL,Goiaspen - Consulta o prontuário de presos e unidades prisionais,Investigação,Restrito,Dev. Interno,CSI-MPGO,Aplicacao especifica,Intranet MPGO
845,2023,MPGO,PAI,MPGO,GERAIS,NACIONAL,SIEL - Consulta o sistema de informações eleitorais do TSE,Investigação,Restrito,Dev. Interno,CSI-MPGO,Aplicacao especifica,Intranet MPGO
846,2023,MPGO,PAI,MPGO,GERAIS,NACIONAL,COAF - Consulta de movimentações financeiras atípicas,Investigação,Restrito,Dev. Interno,CSI-MPGO,Aplicacao especifica,Intranet MPGO
847,2023,MPGO,PAI,MPGO,GERAIS,ESTADUAL,Web Service do Detran para acesso aos dados de CNH e Veículos,Investigação,Restrito,Dev. Interno,CSI-MPGO,Aplicacao especifica,Intranet MPGO
848,2023,MPGO,PAI,MPGO,GERAIS,ESTADUAL,Web Service da SSPGO para acesso aos dados de RG e ocorrências,Investigação,Restrito,Dev. Interno,CSI-MPGO,Aplicacao especifica,Intranet MPGO
849,2023,MPGO,PAI,MPGO,GERAIS,NACIONAL,TSE - Banco de dados de doações eleitorais,Investigação,Restrito,Dev. Interno,CSI-MPGO,Aplicacao especifica,Intranet MPGO
850,2023,MPGO,PAI,MPGO,GERAIS,ESTADUAL,Web Service da SEMAD para acesso aos dados de processos de meio ambiente,Investigação,Restrito,Dev. Interno,CSI-MPGO,Aplicacao especifica,Intranet MPGO
851,2023,MPGO,PAI,MPGO,GERAIS,ESTADUAL,Goiaspen - Consulta o prontuário de presos e unidades prisionais,Investigação,Restrito,Dev. Interno,CSI-MPGO,Aplicacao especifica,Intranet MPGO
852,2023,MPGO,PAI,MPGO,GERAIS,NACIONAL,SIEL - Consulta o sistema de informações eleitorais do TSE,Investigação,Restrito,Dev. Interno,CSI-MPGO,Aplicacao especifica,Intranet MPGO
853,2023,MPGO,PAI,MPGO,GERAIS,NACIONAL,COAF - Consulta de movimentações financeiras atípicas,Investigação,Restrito,Dev. Interno,CSI-MPGO,Aplicacao especifica,Intranet MPGO
854,2023,MPGO,PAI,MPGO,GERAIS,ESTADUAL,Web Service do Detran para acesso aos dados de CNH e Veículos,Investigação,Restrito,Dev. Interno,CSI-MPGO,Aplicacao especifica,Intranet MPGO
855,2023,MPGO,PAI,MPGO,GERAIS,ESTADUAL,Web Service da SSPGO para acesso aos dados de RG e ocorrências,Investigação,Restrito,Dev. Interno,CSI-MPGO,Aplicacao especifica,Intranet MPGO
856,2023,MPGO,PAI,MPGO,GERAIS,NACIONAL,TSE - Banco de dados de doações eleitorais,Investigação,Restrito,Dev. Interno,CSI-MPGO,Aplicacao especifica,Intranet MPGO
857,2023,MPGO,PAI,MPGO,GERAIS,ESTADUAL,Web Service da SEMAD para acesso aos dados de processos de meio ambiente,Investigação,Restrito,Dev. Interno,CSI-MPGO,Aplicacao especifica,Intranet MPGO
858,2023,MPGO,PAI,MPGO,GERAIS,ESTADUAL,Goiaspen - Consulta o prontuário de presos e unidades prisionais,Investigação,Restrito,Dev. Interno,CSI-MPGO,Aplicacao especifica,Intranet MPGO
859,2023,MPGO,PAI,MPGO,GERAIS,NACIONAL,SIEL - Consulta o sistema de informações eleitorais do TSE,Investigação,Restrito,Dev. Interno,CSI-MPGO,Aplicacao especifica,Intranet MPGO
860,2023,MPGO,PAI,MPGO,GERAIS,NACIONAL,COAF - Consulta de movimentações financeiras atípicas,Investigação,Restrito,Dev. Interno,CSI-MPGO,Aplicacao especifica,Intranet MPGO
861,2023,MPGO,DGI LABCONTAS,TCU,LABLD,NACIONAL,Dados de pessoas físicas e jurídicas,Investigação,Restrito,Conv. CNMP,,Consulta on line,http://tcu.gov.br/dgi
862,2023,MPGO,CCS,BACEN,LABLD,NACIONAL,"Dados de contas bancarias de pessoas fisicas e juridicas: banco, numero, agencia, data de abertura e encerramento e titularidade (titulares e co-titulares) e procuradores",Investigação,Restrito,Conv. CNMP,,Consulta on line,https://www3.bcb.gov.br/ccs/dologin
863,2023,MPGO,SIMBA 2.0,MPF/SPPEA,LABLD,Não se aplica,Ferramenta exibe relatorios das quebras bancarias de forma organizada,Investigação,Geral,Conv. Direto,simba@mpf.mp.br,WS - Web Service,
864,2023,MPGO,EVA,LABLD/MPSP,LABLD,Não se aplica,"Ferramenta de Analise de Evolução Patrimonial, a partir de quebras de sigilos fiscais e bancários; apresenta planilhas e gráficos de evolução a descoberto",Investigação,Restrito,Conv. Direto,labld@mpsp.mp.br,Aplicacao especifica,aplicação baixada na máquina
865,2023,MPGO,RIF-Analyzer,LABLD/MPSP,LABLD,Não se aplica,"Ferramenta de Análise de RIFs/COAF; apresenta os dados de forma organizada, com filtros e gera graficos de relacionamento",Investigação,Restrito,Conv. Direto,labld@mpsp.mp.br,Aplicacao especifica,aplicação baixada na máquina
866,2023,MPGO,Consulta Chave-PiX,BACEN,LABLD,NACIONAL,"Dados de cadastro: banco, agência e titularidade",Investigação,Restrito,Conv. Direto,,Consulta on line,
867,2023,MPGO,CIFRA,MPPA,LABLD,Não se aplica,"Ferramenta de Análise Bancária, a partir de quebra de sigilo bancário, apresenta planilhas e gráficos.",Investigação,Restrito,Conv. Direto,gsi@mppa.mp.br,Aplicacao especifica,aplicação baixada na máquina
868,2023,MPGO,SNAP,TECHBIZ,INTELIGÊNCIA CIBERNÉTICA,NACIONAL,Dados de pessoas físicas e jurídicas e vínculos,Inteligência,Restrito,Contrato,,Consulta on line,
869,2023,MPGO,Confirme Online,CREDLINK,INTELIGÊNCIA CIBERNÉTICA,NACIONAL,Dados de pessoas físicas e jurídicas e vínculos,Inteligência,Restrito,Contrato,,Consulta on line,https://www.credilink.com.br/confirme-online/
870,2023,MPGO,POLÍCIA FEDERAL,IPED,EVID. FORENSES,Não se aplica,Extracao e indexacao de dados de equipamentos digitais apreendidos ou de quebras de nuvem,Investigação,Geral,Outro,,Aplicacao especifica,aplicação baixada na máquina
871,2023,MPGO,,FTK,EVID. FORENSES,Não se aplica,Extracao e indexacao de dados de equipamentos digitais apreendidos ou de quebras de nuvem,Investigação,Restrito,Outro,,Aplicacao especifica,aplicação baixada na máquina
872,2023,MPGO,CELlEBRITE,READER,EVID. FORENSES,Não se aplica,Extracao e indexacao de dados de equipamentos digitais apreendidos,Investigação,Geral,Contrato,,Aplicacao especifica,aplicação baixada na máquina
873,2023,MPDFT,Confiteor Lite,Equipe de desenvolvimento DIINT/CI - MPDFT,GERAIS,NACIONAL,Análise de arquivos provenientes de afastamento de sigilo bancário e telefônico,Inteligência,Restrito,Dev. Interno,(61) 3343-9992,Aplicacao especifica,Não se aplica
874,2023,MPDFT,PIN - Pesquisa Integrada,Equipe de desenvolvimento DIINT/CI - MPDFT,GERAIS,NACIONAL,Pesquisa de dados por meio de CPF ou CNPJ,Investigação,Restrito,Dev. Interno,(61) 3343-9992,WS - Web Service,(mediante token)
875,2023,MPDFT,IPTU-DF,,,,Dados de imóveis e proprietários do IPTU do DF,,,,,,
876,2023,MPDFT,IPTU-SP,,,,Dados de imóveis e proprietários do IPTU do SP,,,,,,
877,2023,MPDFT,CEB,,,,Dados cadastrais de clientes da CEB com endereços georreferenciados,,,,,,
878,2023,MPDFT,Protetor,,,,Dados cadastrais de pessoas do sistema de tutelas e curatelas do MPDFT,,,,,,
879,2023,MPDFT,Diligente,,,,Dados cadastrais de pessoas do sistema de diligências do MPDFT,,,,,,
880,2023,MPDFT,Renach,,,,Dados sobre habilitados,,,,,,
881,2023,MPDFT,Renavam,,,,Dados de proriedade veicular,,,,,,
882,2023,MPDFT,CadUnico,,,,Dados de pessoas inscritas em programas sociais do Governo Federal,,,,,,
883,2023,MPDFT,BPC,,,,Beneficiários do Benefício de Prestação Continuada,,,,,,
884,2023,MPDFT,CODHAB,,,,Endereços de candidatos inscritos no programa de habitação popular do DF,,,,,,
885,2023,MPDFT,eCompras,,,,Informações resumidas sobre licitações do Portal de compras do DF,,,,,,
886,2023,MPDFT,SISOBI,,,,Informações detalhadas sobre óbitos do Brasil,,,,,,
887,2023,MPDFT,PEP,,,,Pessoas Expostas Politicamente,,,,,,
888,2023,MPDFT,Servidores Executivo Federal e Terceirizados,,,,Dados de Servidores do Executivo Federal e Terceirizados,,,,,,
889,2023,MPDFT,Aposentados Executivos Federal,,,,Dados de Aposentados do Executivo Federal,,,,,,
890,2023,MPDFT,Pensionistas do Executivo Federal,,,,Dados de Pensionistas do Executivo Federal,,,,,,
891,2023,MPDFT,Militares e Reserva,,,,Dados de Militares e Militares da Reserva,,,,,,
892,2023,MPDFT,Servidores do DF,,,,Dados de Servidores do Executivo do Distrito Federal,,,,,,
893,2023,MPDFT,Servidores aposentados do DF,,,,Dados de Aposentados do Executivo do Distrito Federal,,,,,,
894,2023,MPDFT,RFB,,,,Receita Federal do Brasil (CPF e CNPJ),,,,,,
895,2023,MPDFT,CNE,,,,Dados de empresas e vinculações societárias,,,,,,
896,2023,MPDFT,Caged,,,,Dados de empregados e desempregados,,,,,,
897,2023,MPDFT,Gênesis,,,,Dados cadastrais de pessoas com TCOs ou consultadas no sistema Gênesis (PMDF),,,,,,
898,2023,MPDFT,Milenium*,,,,Dados detalhados de Boletins de Ocorrência no sistema Milenium (PCDF),,,,,,
899,2023,MPRJ,ARISP,CNJ,GERAIS,NACIONAL,Consulta de Registros de Imóveis,Inteligência,Restrito,Conv. CNMP,csi.contratos@mprj.mp.br,Consulta on line,https://oficioeletronico.com.br/
900,2023,MPRJ,BIA,CSI/MPRJ,GERAIS,NACIONAL,Consulta integrada de alvos do MPRJ,Inteligência,Restrito,Dev. Interno,csi.ti@mprj.mp.br,Aplicacao especifica,INTRANET
901,2023,MPRJ,BNMP,CNJ,GERAIS,NACIONAL,Consulta Mandados de Prisão,Investigação,Geral,Outro,csi.pesquisas@mprj.mp.br,Consulta on line,https://portalbnmp.cnj.jus.br/#/captcha/
902,2023,MPRJ,CAGED,MINISTÉRIO DO TRABALHO E EMPREGO - MTE,GERAIS,NACIONAL,Cadastro de vínculos empregatícios,Investigação,Restrito,Conv. CNMP,csi.contratos@mprj.mp.br,Consulta on line,https://geridmte.dataprev.gov.br/cas/login?service=http%3A%2F%2Fcaged.mte.gov.br%2Fcaged%2F%3Bjsessionid%3DbctjmiLTTfEN2D1SQPNXXh1u.slave6%3Amte-caged
903,2023,MPRJ,CDL/RIO,CLUBE DOS DIRETORES LOJISTAS DO RIO DE JANEIRO,GERAIS,NACIONAL,Dados cadastrais e Informações de crédito,Investigação,Restrito,Contrato,csi.contratos@mprj.mp.br,Consulta on line,https://www.cdlrio.com.br/scpc/
904,2023,MPRJ,CENSESC,COLÉGIO NOTORIAL DO BRASIL - CNB,GERAIS,NACIONAL,Consulta de Escrituras e Procurações,Inteligência,Restrito,Conv. CNMP,csi.contratos@mprj.mp.br,Consulta on line,https://censec.org.br/
905,2023,MPRJ,CGJ,PODER JUDICIÁRIO DO ESTADO DO RIO DE JANEIRO,GERAIS,ESTADUAL,Consulta de nascimentos e óbitos,Investigação,Geral,Conv. Direto,csi.pesquisas@mprj.mp.br,Consulta on line,http://www4.tjrj.jus.br/Portal-Extrajudicial/CNO/
906,2023,MPRJ,CNA,OAB NACIONAL,GERAIS,NACIONAL,Cadastro NACIONAL de Advogados,Investigação,Geral,Outro,csi.contratos@mprj.mp.br,Consulta on line,https://cna.oab.org.br/
907,2023,MPRJ,CNIS,MINISTÉRIO DO TRABALHO E EMPREGO - MTE,GERAIS,NACIONAL,Cadastro de vínculos sociais e empregatícios,Investigação,Restrito,Conv. CNMP,csi.contratos@mprj.mp.br,Consulta on line,https://geridmte.dataprev.gov.br/cas/login?service=http%3A%2F%2Fcaged.mte.gov.br%2Fcaged%2F%3Bjsessionid%3DbctjmiLTTfEN2D1SQPNXXh1u.slave6%3Amte-caged
908,2023,MPRJ,CONEXÃO,MPRJ,GERAIS,NACIONAL,"Dados cadastrais de pessoas físicas e jurídicas, processos, veículos e embarcações",Inteligência,Restrito,Dev. Interno,csi.ti@mprj.mp.br,Aplicacao especifica,INTRANET
909,2023,MPRJ,CÓRTEX,SEOPI/MJSP,GERAIS,NACIONAL,"Consulta de veículos, pessoas, condutores, radares, empresas e embarcações",Inteligência,Restrito,Conv. CNMP,csi.contratos@mprj.mp.br,Consulta on line,https://cortex.mj.gov.br/
910,2023,MPRJ,CRC,CNJ,GERAIS,NACIONAL,Cadastro de informações dos Cartórios de Registro Civil das Pessoas Naturais,Investigação,Restrito,Conv. CNMP,csi.contratos@mprj.mp.br,Consulta on line,https://sistema.registrocivil.org.br/portal/?CFID=1378524&CFTOKEN=4c047bf8ba0b28a3-F3CAE6CA-D221-A1E7-E9EAE7291CADC9DD
911,2023,MPRJ,CREDILINK,CREDILINK,GERAIS,NACIONAL,Dados cadastrais e Informações de crédito,Investigação,Restrito,Contrato,csi.contratos@mprj.mp.br,Consulta on line,https://consulta4.confirmeonline.com.br/validarLogin/confirmeOnline.xhtml;jsessionid=3B762C1EEF4F3CEA1416607D4E7D418B
912,2023,MPRJ,DIC,DEPARTAMENTO ESTADUAL DE TRÂNSITO DO RIO DE JANEIRO - DETRAN/RJ,GERAIS,ESTADUAL,"Identificação civil estadual, antecedentes criminais (FAC), dados da carteira nacional de habilitação (CNH), identificação datiloscópica, assinaturas, fotografias e endereços",Inteligência,Restrito,Conv. Direto,csi.contratos@mprj.mp.br,Consulta on line,https://10.200.96.108/ConsultaNet/mc3web/IULogin.aspx
913,2023,MPRJ,DOINET,IMPRENSA NACIONAL,GERAIS,NACIONAL,Consulta de Diários Oficiais e Legislação,Investigação,Geral,Conv. Direto,csi.ti@mprj.mp.br,Aplicacao especifica,INTRANET
914,2023,,DOERJ,IMPRENSA ESTADUAL,GERAIS,ESTADUAL,Consulta de Diários Oficiais,Investigação,Geral,Conv. Direto,csi.ti@mprj.mp.br,Aplicacao especifica,INTRANET
915,2023,MPRJ,JUCERJA,JUCERJA,GERAIS,ESTADUAL,"Cadastro de empresas, sócios e atos constitutivos",Investigação,Restrito,Conv. Direto,csi.contratos@mprj.mp.br,Consulta on line,https://www.jucerja.rj.gov.br/
916,2023,MPRJ,MGP,MPRJ,GERAIS,ESTADUAL,Módulo de Gestão de Processos (MGP) do Ministério Público do Estado do Rio de Janeiro (MPRJ,Investigação,Restrito,Dev. Interno,csi.ti@mprj.mp.br,Aplicacao especifica,INTRANET
917,2023,MPRJ,PANDORA,MPRJ,GERAIS,NACIONAL,Banco de dados integrado do MP,Inteligência,Restrito,Dev. Interno,csi.ti@mprj.mp.br,Aplicacao especifica,INTRANET
918,2023,MPRJ,PORTAL DA SEGURANÇA DO ESTADO DO RIO DE JANEIRO,DEPARTAMENTO ESTADUAL DE TRÂNSITO DO RIO DE JANEIRO - DETRAN/RJ,GERAIS,ESTADUAL,Cadastro civil e criminal,Inteligência,Restrito,Conv. Direto,csi.contratos@mprj.mp.br,Consulta on line,https://10.200.96.20/portalnew/portal/FrameSetLogin.aspx?Root=Portal
919,2023,MPRJ,PREVINITY,PREVINITY,GERAIS,NACIONAL,Dados cadastrais e Localizador de endereços PF e PJ,Investigação,Restrito,Contrato,csi.ti@mprj.mp.br,Consulta on line,https://consulta.previnity.com.br/login.php
920,2023,MPRJ,RAIS,MINISTÉRIO DO TRABALHO E EMPREGO - MTE,GERAIS,NACIONAL,Relação Anual de Informações Sociais,Investigação,Restrito,Conv. CNMP,csi.contratos@mprj.mp.br,Consulta on line,https://geridmte.dataprev.gov.br/cas/login?service=http%3A%2F%2Fcaged.mte.gov.br%2Fcaged%2F%3Bjsessionid%3DbctjmiLTTfEN2D1SQPNXXh1u.slave6%3Amte-caged
