id,ANO,MP,SOLUCAO,DESENVOLVEDOR,CATEGORIA,ABRANGENCIA,FUNCIONALIDADE,FINALIDADE,PERMISSIONAMENTO,FONTE,CONTATO,CONSUMO,LINK
176,2023,MPPA,GALACTUS,MPSE,GERAIS,NACIONAL,"Acessar informações cadastrais sobre pessoas físicas e jurídicas, inclusive pesquisa por CPF, CNPJ, nome da mãe e pai, fazendo também cruzamento de vínculos entre entidades.",Investigação,,,ANDERSON SANTOS - (91) 3210-3540,,https://galactus.mppa.mp.br/user/login
177,2023,MPPA,GEO-OBRAS,TRIBUNAL DE CONSTAS DO MUNICÍPIOS DO PARÁ - TCMPA,GERAIS,ESTADUAL,Acessar informações sobre certames licitatórios e contratos de obras públicas municipais,Investigação,,,ANDERSON SANTOS - (91) 3210-3540,,https://geoobras.tcm.pa.gov.br/Cidadao
178,2023,MPPA,INFOPEN,SECRETARIA DE ADMINISTRAÇÃO PENITENCIÁRIA - SEAP,GERAIS,ESTADUAL,Informações pernitenciárias do Pará,Inteligência,,,ANDERSON SANTOS - (91) 3210-3540,,https://infopenpa.seap.pa.gov.br/
179,2023,MPPA,LINCE,TRIBUNAL DE CONSTAS DO MUNICÍPIOS DO PARÁ - TCMPA,GERAIS,ESTADUAL,"Acessar informações licitantes e folhas de pagamentos de municípios paraenses, bem como informações sobre processos de julgamento de contas.",Investigação,,,ANDERSON SANTOS - (91) 3210-3540,,https://www.tcm.pa.gov.br/aplicacoes-tcm/lince-parceiros/site/login
180,2023,MPPA,REGIN,JUNTA COMERCIAL DO PARÁ - JUCEPA,GERAIS,ESTADUAL,"Acessar informações cadastrais de empresas e cooperativas registradas na Junta Comercial do Estado do Pará (JUCEPA), inclusive digitalização de atos registrados e procurações.",Investigação,,,ANDERSON SANTOS - (91) 3210-3540,,http://regin.jucepa.pa.gov.br/regin/account/login
181,2023,MPPA,CREDLINK,CREDLINK,GERAIS,NACIONAL,Ferramentas de localização de dados do mercado,Inteligência,,,BRUNO LOPES - (91) 3210-3540,,https://confirme30.confirmeonline.com.br/auth/login?_ga=2.19326907.2068220659.1680032517-183673206.1679919333&_gac=1.187363162.1679919333.CjwKCAjw_YShBhAiEiwAMomsEAttwUn3J53JQhseEK8-CW0FH9kbhkm4c35zh-Iz6rjoOExZCKuGaxoCGAAQAvD_BwE
182,2023,MPPA,SITAC,CONSELHO REGIONAL DE ENGENHARIA  E AGRONOMIA - CREA,GERAIS,ESTADUAL,"Pesquisa de registros de prossionias enegenheiro, pessoas físicas e jurídicas",Inteligência,,,PEDRO MOREIRA - (91) 3210-3540,,https://crea-pa.sitac.com.br/app/view/pages/login/login.php
183,2023,MPPA,CRC-JUD,ARPENBRASIL,GERAIS,NACIONAL,"L Acesso ao CRC-JUD, sistema de pesquisa e solicitação de emissão de CERTIDÕES DIGITAIS, por meio do uso da plataforma da Central de Informações de Registro Civil de Pessoas Naturais – CRC.",Investigação,,,PEDRO MOREIRA - (91) 3210-3540,,https://sistema.registrocivil.org.br/portal/?CFID=9353204&CFTOKEN=291c5c23f11b5983-CDB9CB67-DA96-94C0-2659F953F3349778
184,2023,MPPA,SIEL,TRIBUNAL SUPERIOR ELEITORAL - TSE,GERAIS,NACIONAL,Pesquisa a registros de eleitores,Investigação,,,PEDRO MOREIRA - (91) 3210-3540,,https://siel.tse.jus.br/session/new
185,2023,MPPA,IPED,POLÍCIA FEDERAL,EVID. FORENSES,NACIONAL,Análide de evidências digitais,Investigação,,,JHONNY BACELAR - (91) 3210-3540,,
186,2023,MPPA,CELLEBRITE READER,CELLEBRITE,EVID. FORENSES,NACIONAL,Análide de evidências digitais,Investigação,,,JHONNY BACELAR - (91) 3210-3540,,
187,2023,MPPA,AXION MAGNET,MAGNET FORENSE,EVID. FORENSES,NACIONAL,Análide de evidências digitais,Investigação,,,JHONNY BACELAR - (91) 3210-3540,,
188,2023,MPMS,SNAP,TECHBIZ,EVID. FORENSES,NACIONAL,"Solução de localização, transformação e apresentação de dados coletados de fontes públicas, comerciais e privadas para análise gráfica de perfis e entidades, com customização",Inteligência,Restrito,Contrato,Diogo Banzer,Aplicacao especifica,
189,2023,MPMS,UFED Physical Analyser,Cellebrite,EVID. FORENSES,NACIONAL,Ferramenta responsável pelo processamento da extração realizada pelo UFED 4PC - indexando e categorizando os dados extraídos com geração de relatório,Investigação,Restrito,Contrato,Diogo Banzer,Não se aplica,
190,2023,MPMS,UFED 4PC,Cellebrite,EVID. FORENSES,NACIONAL,Ferramenta de extração de dados de dispositivos móveis,Investigação,Restrito,Contrato,Diogo Banzer,Não se aplica,
191,2023,MPMS,IPED,Disponível no GITHUB,EVID. FORENSES,NACIONAL,Ferramenta Open Source para indexação de dados,Investigação,Restrito,Outro,Diogo Banzer,Não se aplica,
192,2023,MPMS,Aplicativo Cadeia de Custódia (disponível no Portal Hórus),Centro de Inteligência do MPMS,EVID. FORENSES,Não se aplica,"Aplicatico desenvolvido para que as buscas e apreensões sejam registradas todas pelo celular, automatizando o processo e reduzindo o quantitativo de papéis. Complementar a isso, o acompanhamento da mvimentação do vestígio é feito todo pelo Portla Hórus garantindo a integridade da cadeia de custódia",Investigação,Restrito,Dev. Interno,Diogo Banzer,Não se aplica,
193,2023,MPMS,Pathfinder,Cellebrite,EVID. FORENSES,Não se aplica,Solução para processamento e análise colaborativa de dados de plataformas eletrônicas portáteis cruzamento de vínculos e análise avançada de mídias (com garantia e,Investigação,Restrito,Contrato,Diogo Banzer,Não se aplica,
194,2023,MPMS,UFED Premium,Cellebrite,GERAIS,NACIONAL,"Ferramenta responsável pela descoberta ou contorno de bloqueio de senhas desconhecidas em dispositivos móveis, da mesma forma, a extração dos dados armazenados.",Inteligência,Restrito,Contrato,Diogo Banzer,Aplicacao especifica,
195,2023,MPMS,Credilink,Credilink,GERAIS,NACIONAL,"Solução para consulta de dados cadastrais, vinculos, óbito de pessoa física e dados diversos de empresas",Inteligência,Restrito,Contrato,Diogo Banzer,WS - Web Service,
196,2023,MPMS,SERPRO,Credilink,GERAIS,NACIONAL,"Consulta de informações não protegidas por sigilo fiscal, relativa as bases atualizadas de Cadastro de Pessoa Física (CPF), Cadastro de Pessoa Jurídica (CNPJ), Simples NACIONAL (SN)",Inteligência,Restrito,Contrato,Diogo Banzer,Aplicacao especifica,
197,2023,MPMS,CORTEX,MJSP,GERAIS,NACIONAL,"Consulta de informações não protegidas por sigilo fiscal, relativa as bases atualizadas de Pessoa Física (CPF), Cadastro de Pessoa Jurídica (CNPJ) bem como veículos e Mandados de Prisão",Inteligência,Restrito,Conv. Direto,Diogo Banzer,Aplicacao especifica,
198,2023,MPMS,CNIS,MJSP,GERAIS,NACIONAL,Consulta de informações Relativas a Previdência Social,Inteligência,Restrito,Conv. CNMP,Diogo Banzer,Consulta on line,
199,2023,MPMS,SIAPEN,AGEPEN,GERAIS,ESTADUAL,Consulta de informações Relativas ao Sistema Prisional do Estado do Mato Grosso do Sul,Inteligência,Restrito,Conv. Direto,Diogo Banzer,Aplicacao especifica,
200,2023,MPMS,Robô da Ficha Limpa,Laboratório de Inovação do MPMS,GERAIS,NACIONAL,"Consulta de processos da Justiça Federal, JFSP, CNJ, TCU, TCE, TER, TRF3 Jurisprudência e servidores do MPMS",Inteligência,Restrito,Dev. Interno,Diogo Banzer,Consulta on line,
201,2023,MPMS,Consulta de Processos Eletrônicos MPMS,Setor de Tecnologia da informação do MPMS,GERAIS,ESTADUAL,Disponibilização de consultas de dados de Processos contidos no SAJ MPMS,Inteligência,Restrito,Dev. Interno,Diogo Banzer,Consulta on line,
202,2023,MPMS,BURP SUITE,PostSwigger,GERAIS,Não se aplica,Reaizar testes de segurança em aplicações web,Inteligência,Restrito,Outro,Diogo Banzer,Consulta on line,
203,2023,MPMS,Dehashed,PostSwigger,GERAIS,Não se aplica,"Motor de busca de bases de dados hackeados criado para analistas de segurança, jornalistas, empresas de segurança e pessoas cotidianas para ajudar a proteger contas e fornecer informações sobre violações de banco de dados e vazamentos de contas.",Inteligência,Restrito,Outro,Diogo Banzer,Consulta on line,
204,2023,MPMS,Hórus Qlikview,Centro de Inteligência do MPMS,LABLD,Não se aplica,Sintetiza e esquematiza as quebras de dados bancários oriundos do SIMBA,Inteligência,Restrito,Dev. Interno,Diogo Banzer,Aplicacao especifica,
205,2023,MPMS,SIMBA,SPPEA ( Assessoria de Pesquisa e Análise da Procuradoria-Geral da República,LABLD,Não se aplica,Sistema desenvolvido para consolidar todas as transmissões oriundas da quebra de sigilo bancário,Investigação,Restrito,Conv. CNMP,Diogo Banzer,Aplicacao especifica,
206,2023,MPMS,SITTEL,Policia Federal,LABLD,Não se aplica,"promover a coleta, o processamento padronizado e a análise de dados telefônicos e telemáticos",Investigação,Restrito,Conv. CNMP,Diogo Banzer,Aplicacao especifica,
207,2023,MPMS,Pharos (desenvolvida no Qlick Sense),Policia Federal,LABLD,Não se aplica,Sintetiza e esquematiza as quebras de dados bancários,Investigação,Restrito,Conv. Direto,Diogo Banzer,Aplicacao especifica,
208,2023,MPMS,CIAF Bancário e de RIF (desenvolvida no Qlick Sense),Policia Federal,LABLD,Não se aplica,Sintetiza e esquematiza as quebras de dados bancários e fiscal,Investigação,Restrito,Conv. Direto,Diogo Banzer,Aplicacao especifica,
209,2023,MPMS,Confiteor,MPDFT,LABLD,Não se aplica,Sintetiza e esquematiza as quebras de dados bancários,Investigação,Restrito,Conv. Direto,Diogo Banzer,Aplicacao especifica,
210,2023,MPMS,CIFRA (desenvolvida no Power BI),MPPA,LABLD,Não se aplica,Sintetiza e esquematiza as quebras de dados bancários,Investigação,Restrito,Conv. Direto,Diogo Banzer,Aplicacao especifica,
211,2023,MPMS,COAF (desenvolvido em Excel),COAF,LABLD,Não se aplica,Sintetiza e esquematiza os RIFS enviados e/ou solicitados ao COAF,Investigação,Restrito,Conv. Direto,Diogo Banzer,Aplicacao especifica,
212,2023,MPMS,IBM I2,I2 Limited,LABLD,Não se aplica,"Sintetiza e esquematiza as quebras de dados bancáriostransformar conjuntos de dados difíceis e díspares em inteligência abrangente, quase em tempo real. É possível obter conexões e padrões ocultos enterrados em conjuntos de dados empresariais, de terceiros e públicos.",Investigação,Restrito,Contrato,Diogo Banzer,Aplicacao especifica,
213,2023,MPCE,SIMPCE - Sistema de Investigação do MPCE,GLEIDSON SOBREIRA LEITE,GERAIS,NACIONAL,"Sistema que integra diversas bases de dados como RECEITA, DETRAN/CE, CAGECE, RAIS, SISPEN, SISOBI, BOLSA FAMÍLIA, AUXÍLIO EMERGENCIAL, TCE/CE, TRE/CE, entre outras, com diversas funcionalidades como, por exemplo:

Consulta integrada PF e PJ: Consulta de dados cadastrais, endereços, telefones, veículos, vínculos de parentesco, vínculos empregatícios, participação societária, informações do sistema prisional, dados de óbito, entre outros.
Gráfico de Vínculos: Possibilita criar e desenhar vínculos diversos utilizando ou não as bases de dados
Cruzamentos Bancários: Consultas, análise e cruzamentos diversos de extratos bancários obtidos do SIMBA com acesso autorizado judicialmente e restrito apenas a usuários com acesso aos CASOS
Licitações de Municípios do Estado do Ceará: Consultas, análise e cruzamentos de diversas informações das bases de dados de licitações dos municípios do Estado do Ceará
Consultas Diversas: Consultas diversas as bases que o MPCE possui acesso por meio de convênio ou acordo de cooperação técnica",,,,nati@mpce.mp.br,,interno - intrantet
214,2023,MPCE,MP SHERLOCK - Sistema de Automação de Atividades Investigativas,GLEIDSON SOBREIRA LEITE,GERAIS,NACIONAL,"Sistema que visa à automação de fluxos de atividades investigativas em bases de dados onde, em muitas funcionalidades, o usuário apenas insere um conjunto de CPFs ou CNPJs que deseja investigar, seleciona os quesitos a serem investigados e a ferramenta realiza o trabalho gerando os relatórios de forma automatizada.

O sistema é composto por 4 módulos principais, sendo eles:

Análise de Vínculos: Funcionalidade que automatiza a busca, cruzamento e análise de vínculos entre pessoas (PF e/ou PJ) disponibilizando o resultado em relatórios automatizados ou gráficos de vínculos. Exemplos de vínculos identificados: vínculos de parentesco, participação em quadro societário, vínculos empregatícios, doações eleitorais, fornecedores em licitações, mesmo endereço, mesmo telefone e participação como licitantes em licitações municipais
Análise Investigativa: Inserindo um conjunto de CPFs e/ou CNPJs que se deseja investigar, com essa funcionalidade o usuário seleciona um ou mais quesitos investigativos e a ferramenta já disponibilita o resultado da análise investigativa através de relatórios automatizados
Análise Bancária: Para utilizar essa funcionalidade o usuário deve ter acesso a casos no SIMBA. Tendo acesso, apenas selecionando o caso e o quesito que se deseja investigar, a ferramenta realiza a análise bancária de forma automatizada já disponibilizando o relatório.
Indicadores: Funcionalidade que utiliza o conceito de Tipologias no qual, a partir de listas de tipologias já disponibilizada, a ferramenta categoriza um conjunto de indivíduos que se enquadraram na Tipologia, disponibilizando um conjunto de informações diversas através de gráficos e tabelas, também podendo gerar relatórios de forma automatizada.",,,,nati@mpce.mp.br,,interno - intrantet
215,2023,MPCE,MP Custódia - Sistema de Automação e Registro de Cadeia de Custódia,GLEIDSON SOBREIRA LEITE,GERAIS,ESTADUAL,"Sistema de Automação para Registro e Acompanhamento de Cadeia de Custódia que visa à automação e centralização de registro e monitoramento da Cadeia de Custódia de Materiais Apreendidos, assim como controle, alocação e acompanhamento automatizado de estoque de itens (recipientes ou invólucros) utilizados em operações (exemplo: envelopes, lacres, malotes, entre outros).",,,,nati@mpce.mp.br,,interno - intrantet
216,2023,MPCE,MP E-Fiscal - Sistema de Cruzamentos de Dados Fiscais (Notas fiscais) e Dados Bancários,GLEIDSON SOBREIRA LEITE,GERAIS,ESTADUAL,"A solução possibilita realizar (com base em filtros diversos disponíveis aos usuários) cruzamentos de dados fiscais, cruzamentos de dados fiscais e bancários, e obter informações dos cruzamentos em tabelas dinâmicas, relatórios, grafícos de vínculos e gráficos diversos.",,,,nati@mpce.mp.br,,interno - intrantet
217,2023,MPCE,"LAB-ADM -  Sistema de Gestão e Acompanhamento de Demandas, Repositório Digital, entre outros.",GLEIDSON SOBREIRA LEITE,GERAIS,ESTADUAL,"Sistema que visa a automação  do controle, acompanhamento e gestão de demandas internas de setores especializados como, por exemplo, núcleos de inteligência, órgãos de investigação ou Laboratório de Tecnologia e Combate à Lavagem de Dinheiro. O intuito é possibilitar uma base unificada de documentos e informações de demandas atendidas pelos setores ou órgãos, com a possibilidade de reaproveitamento de trabalho, localização de informações e documentos de envolvidos (investigados) de qualquer lugar de forma remota, construção de base de inteligência, acompanhamento de demandas em tempo real, gerenciamento e armazenamento de informações referentes aos procedimentos de extração de equipamentos eletrônicos apreendidos, geração de relatórios gerenciais automatizados, entre outros.",,,,nati@mpce.mp.br,,interno - intrantet
218,2023,MPCE,"MP-Intel - Sistema de Cadastro de Investigados, Facções Criminosas e Mapeamento de Facções",GLEIDSON SOBREIRA LEITE,GERAIS,ESTADUAL,"Sistema para cadastramento, vinculação e mapeamento de investigados (incluindo membros de facções criminosas). Com o sistema, busca-se criar uma base de inteligência contendo diversas informações sobre investigados, membros de facções, vínculos diversos entre os mesmos, mapeamento com diversos filtros, armazenamento de arquivos digitais (ex: processos, fotos, documentos diversos...), entre outros.",,,,nati@mpce.mp.br,,interno - intrantet
219,2023,MPCE,Consulta Integrada - Sistema simplificado de Consulta de Pessoas Físicas e Jurídicas,GLEIDSON SOBREIRA LEITE,GERAIS,NACIONAL,"Sistema de consulta de perfil (dados cadastrais, vínculos empregatícios, veículos, dependentes e informações do SISPEN) de pessoas físicas e jurídicas

Versão simplificada do SIMPCE com foco na funcionalidade de consulta integrada",,,,nati@mpce.mp.br,,interno - intrantet
220,2023,MPCE,BASES DE DADOS,NÃO SE APLICA,GERAIS,ESTADUAL,"> RECEITA FEDERAL
> RAIS
> CAGED
> SEFAZ
> SISOBI
> SIMBA
> TCE/CE 
> TRE/CE (PÚBLICA)
> AERONAVES 
> EMBARCAÇÕES 
> BOLSA FAMÍLIA 
> AUXÍLIO EMERGENCIAL
> EXTRATOS BANCÁRIOS ÓRGÃOS PÚBLICOS MUNICIPAIS CE
> BASES DE SIGILO (Exemplo Extratos Bancários, Extratos Telefônicos, outros)
> BASES DE INTELIGÊNCIA",,,,,,
221,2023,MPCE,WEB SERVICES,NÃO SE APLICA,GERAIS,ESTADUAL,"> SISPEN/SISGEPEN 
> CAGECE (pausada)
> DETRAN/CE
> CDL
> TJCE
> JUCEC
> CREDLINK 
> REGISTROS CIVIS",,,,,,
222,2023,MPMG,ADUNA/LINS,GSI/MPMG,GERAIS,NACIONAL,"Ferramenta digital para pesquisa de dados de pessoas físicas e jurídicas numa única consulta de diversas bases de dados - acessível via Web, sem uso de aplicativos ou softwares",Investigação,Restrito,Conv. Direto,,Consulta on line,https://aduna.mpmg.mp.br/
223,2023,MPMG,MAPA SOCIAL,GSI/MPMG,GERAIS,ESTADUAL,"Ferramenta que reúne indicadores sociais dos municípios mineiros educação, saúde e segurança pública - socioeconômicos e demográficos - tabela dinâmica - totalizando 172 indicadores sociais",,,,,,
224,2023,MPMG,AISE,GSI/MPMG,GERAIS,NACIONAL,Mapa de Desenvolvimento Sustentável Atlas 2030 ONU,,,,,,
225,2023,MPMG,ARCANJO,GSI/MPMG,EVID. FORENSES,NACIONAL,"Aprendizado de máquina para identificar a presença de pornografia infantil em imagens e vídeos, com fatoração do problema em três subproblemas - detecção de faces, estimativa de idade e detecção de pornografia",,,,,,
226,2023,MPMG,TRENA,GSI/MPMG,EVID. FORENSES,ESTADUAL,Aplicativo auxiliar na fiscalização de obras públicas em andamento e também novo módulo para atender à Central de Perícias Técnicas do MPMG - perícias virtuais de obras públicas,,,,,,
227,2023,MPMG,PROCON DATA,GSI/MPMG,GERAIS,NACIONAL,"Sistema Inteligente de Suporte ao PROCON-MG, visa apoiar as atividades de atendimento ao público e de apoio jurídico - dentre outras, prover uma plataforma de busca integrada por meio da qual o PRONCON-MG pode realizar buscas avançadas em base que congrega outros sistemas de manifestações e de reclamações dos consumidores",,,,,,
228,2023,MPMG,QUANTO CUSTA,"DINI - GSI-MPMG
DINI - Diretoria do GSI desenvolvimento de Tecnologias
de Inteligência, Informação e Investigação",GERAIS,NACIONAL,"Sistema aprovado já pelo grupo de testes para consulta de preços de itens de compras públicas, por exemplo, ajudando a identificar sobrepreços, apontar possíveis riscos ou indícios de irregularidaes nos certames",,,,,,
229,2023,MPMG,TIRA-TEIMA,DINI - GSI-MPMG,GERAIS,NACIONAL,"Sistema aprovado já pelo grupo de testes para consulta de preços de itens de compras públicas, por exemplo, ajudando a identificar sobrepreços, apontar possíveis riscos ou indícios de irregularidaes nos certames",,,,,,
230,2023,MPMG,CAMPANHA ELEITORAL LEGAL,DINI - GSI-MPMG,GERAIS,ESTADUAL,"Ferramenta que indica, de forma automática, posts e mensagens na rede social X (Twitter) que são potenciais propagandas eleitorais fora de época (antecipadas).",,,,,,
231,2023,MPMG,ÁQUILA,DINI - GSI-MPMG,GERAIS,ESTADUAL,Ferramenta de reconhecimento facial e detecção de objetos (veículos e armas) em imagens e vídeos - liberação total por volta de março de 2024,,,,,,
232,2023,MPMG,BEAGLE MPMG,GSI/MPMG - LABINT - TABLEAU,GERAIS,NACIONAL,"Ferramenta - a partir do código cedido pelo MPRN, para cruzamento de dados do BNMP em diversas bases de dados, informações fornecidas aos usuários com paineis interativos BI, atualização mensal das informações",,,,,,
233,2023,MPMG,BIRD,GSI/MPMG,GERAIS,NACIONAL,API para busca de informações textuais em linguagem natural não estruturada - gera ranking de documentos relevantes para o usuário,,,,,,
234,2023,MPMG,HORSE,GSI/MPMG,GERAIS,NACIONAL,"Haversting Online Resouce System Engine - HORSE - plataforma web que permite aos usuários configurarem coletores de dados de forma personalizada e flexível para atingir o objetivo de extrair dados de uma fonte específica de informações - obtenção de dados atualizados e relevantes, várias especificidades",,,,,,
235,2023,MPMA,SINESP INFOSEG,SENASP,GERAIS,NACIONAL,Consulta à base de dados diversos da Receita Federal,Investigação,Restrito,Conv. Direto,Externo,Consulta on line,
236,2023,MPMA,CENSEC - CARTÓRIOS,CARTÓRIOS BRASIL,GERAIS,NACIONAL,"TESTAMENTOS, PROCURAÇÕES E ESCRITURAS",Investigação,Restrito,Conv. CNMP,Externo,Consulta on line,
237,2023,MPMA,SICAR,GOV.BR,GERAIS,NACIONAL,SISTEMA DE VERIFICAÇÃO DE CADASTROS AMBIENTAIS RURAIS,Investigação,Restrito,Conv. Direto,Externo,Consulta on line,
238,2023,MPMA,SIGEF - INCRA,MAPA,GERAIS,NACIONAL,SISTEMA DE GESTÃO DE INFORMAÇÕES FUNDIÁRIAS DO MEIO RURAL BRASILEIRO,Investigação,Geral,Outro,Externo,Consulta on line,
239,2023,MPMA,PANDORA,MPPB,GERAIS,NACIONAL,Consulta à base de dados diversos e analítico,Investigação,Restrito,Conv. Direto,Externo,Consulta on line,
240,2023,MPMA,PLUTÃO,MPM,GERAIS,NACIONAL,Consulta à base de dados diversos,Investigação,Restrito,Conv. Direto,Externo,Consulta on line,
241,2023,MPMA,ARCTOS,MPMA,GERAIS,NACIONAL,Consulta à base de dados diversos,Investigação,Restrito,Dev. Interno,Interno,Consulta on line,
242,2023,MPMA,SIISP,SECRETARIA DE ESTADO DE ADMINISTRAÇÃO PENITENCIÁRIA,GERAIS,ESTADUAL,SISTEMA DE INFORMAÇÕES PRISIONAIS DO MARANHÃO,Inteligência,Restrito,Conv. Direto,Externo,Consulta on line,
243,2023,MPMA,SIGMA,SECRETARIA DE SEGURANÇA PUBLICA DO MARANHÃO,GERAIS,ESTADUAL,INFORMAÇÕES SOBRE REGISTROS DE OCORRÊNCIAS NO MARANHÃO,Investigação,Restrito,Conv. Direto,Externo,Consulta on line,
244,2023,MPMA,RETINA,MPAC,GERAIS,NACIONAL,CADASTRO E INFORMAÇÕES  DE FACCIONADOS A NÍVEL NACIONAL,Inteligência,Restrito,Conv. Direto,Externo,Consulta on line,
245,2023,MPMA,AFOC,SSP MA,GERAIS,ESTADUAL,CADASTRO E INFORMAÇÕES  DE FACCIONADOS A NÍVEL ESTADUAL,Inteligência,Restrito,Conv. Direto,Externo,Consulta on line,
246,2023,MPMA,ADUNA,MPMG,GERAIS,NACIONAL,Consulta à base de dados diversos,Investigação,Restrito,Conv. Direto,Externo,Consulta on line,
247,2023,MPMA,ABIS,VALID,GERAIS,ESTADUAL,INFORMAÇÕES SOBRE REGISTROS CIVIS DO ESTADO DO MARANHÃO,Investigação,Restrito,Contrato,Externo,Consulta on line,
248,2023,MPMA,SACOP,TRIBUNAL DE CONTAS DO ESTADO DO MARANHÃO,GERAIS,ESTADUAL,INFORMAÇÕES SOBRE LICITAÇÕES E CONTRATOS,Investigação,Restrito,Conv. Direto,Externo,Consulta on line,
249,2023,MPMA,JUCEMA,JUNTA COMERCIAL DO MARANHÃO,GERAIS,ESTADUAL,INFORMAÇÕES SOBRE PESSOAS JURÍDICAS / QUADRO SOCIETÁRIO / BALANÇO PATRIMONIAL / ALTERAÇÕES DE ATOS EMPRESARIAIS,Investigação,Restrito,Conv. Direto,Externo,Consulta on line,
250,2023,MPMA,SGI,PMMA,GERAIS,ESTADUAL,SISTEMA DE GESTÃO DE INFORMAÇÕES ACERCA DE POLICIAIS MILITARES DO MARANHÃO,Inteligência,Restrito,Conv. Direto,Externo,Consulta on line,
251,2023,MPMA,CORTEX,MJ,GERAIS,NACIONAL,SISTEMA DE GESTÃO DE INFORMAÇÕES ACERCA DE POLICIAIS MILITARES DO MARANHÃO,Inteligência,Restrito,Conv. Direto,Externo,Consulta on line,
252,2023,MPMA,Transcritor,MPMA,GERAIS,Não se aplica,Sistema pra transcrição de áudios/vídeos.,Investigação,Restrito,Dev. Interno,Interno,Não se aplica,
253,2023,MPPI,INFOSEG,PRODESP,GERAIS,NACIONAL,Dados de pessoas físicas e jurídicas; CNH (fotos nao atuais),Investigação,Geral,Conv. Direto,,Consulta on line,https://seguranca.sinesp.gov.br/sinesp-seguranca/login.jsf?goto=INFOSEG
254,2023,MPPI,CAGED,MINISTERIO DA ECONOMIA,GERAIS,NACIONAL,"Registros trabalhistas atuais e historico, com datas de admissao e demissao; nivel de escolaridade",Investigação,Geral,Conv. Direto,,Consulta on line,https://geridmte.dataprev.gov.br/cas/login?service=https%3A%2F%2Fcaged.mte.gov.br%2Fcaged%2F
255,2023,MPPI,CCS,BACEN,LABLD,NACIONAL,"Dados de contas bancarias de pessoas fisicas e juridicas: banco, numero, agencia, data de abertura e encerramento e titularidade (titulares e co-titulares) e procuradores",Investigação,Restrito,Conv. Direto,,Consulta on line,https://www3.bcb.gov.br/ccs/dologin
256,2023,MPPI,SIMBA 2.0,MPF/SPPEA,LABLD,Não se aplica,Ferramenta exibe relatorios das quebras bancarias de forma organizada,Investigação,Restrito,Conv. Direto,PGR-simba@mpf.mp.br,WS - Web Service,a-mpspbr.msappproxy.net/simba/
257,2023,MPPI,Qlik Sense,,LABLD,Não se aplica,"Possibilita a criação de paineis com dados de quebra de sigilo bancário e de relatórios de inteligência financeira, a fim de facilitar a análise pelo Laboratório.",Investigação,Restrito,,,,
258,2023,MPPI,JUCEPI,,LABLD,ESTADUAL,Permite o acesso a todos documentos arquivos na Junta Comercial do Estado do Piauí,Investigação,Restrito,Conv. Direto,,,
259,2023,MPPI,SisBO,,LABLD,ESTADUAL,Sistema que permite a consulta ao boletins de ocorrência registrados no estado do Piauí,Investigação,Restrito,Conv. Direto,,,
260,2023,MPPI,SisProcep,,LABLD,ESTADUAL,Sistema que permite a consulta aos inquéritos policiais abertos no estado do Piauí,Investigação,Restrito,Conv. Direto,,,
261,2023,MPPI,DOM,,LABLD,ESTADUAL,Sistema que permite a consulta dinâmica das publicações de todos os municípios do estado do Piauí,Investigação,Restrito,Conv. Direto,,,
262,2023,MPPI,CDL/SPC Brasil,SPC,LABLD,NACIONAL,Permite a consulta de dados cadastrais de consumidores em todo o País,Investigação,Restrito,Conv. Direto,,Consulta on line,https://sistema.spc.org.br/spc/controleacesso/autenticacao/entry.action
263,2023,MPPI,Argus,,LABLD,Não se aplica,Permite a análise de dados decorrentes de quebra de sigilo bancário,Investigação,Restrito,Conv. Direto,,,
264,2023,MPPI,CENSEC,,LABLD,NACIONAL,Sistema que apresenta atos cartorários realizados em âmbito nacional,Investigação,Restrito,,,,
265,2023,MPPI,SEIC-C COAF,,LABLD,Não se aplica,Permite o intercâmbio de relatórios de inteligência financeira com o COAF,Investigação,Restrito,,,,
